,country,description,designation,points,price,province,region_1,region_2,taster_name,taster_twitter_handle,title,variety,winery
254,US,"The winery has a good track record with this bottling, which shows how well Petite Sirah does in the warmer St. Helena appellation of Napa Valley. This '08 is dryish to moderately sweet in jammy blackberries and blueberries, with a smoked meat, bacon edge. But it's also firmly tannic, which provides a framework for the sweetness.",,89,45.0,California,St. Helena,Napa,,,David Fulton 2008 Petite Sirah (St. Helena),Petite Sirah,David Fulton
255,US,"Esterlina's Pinot is very perfumey, light in body and soul at first, as it gathers steam with a tasty backbone of lush red fruit, spice and plenty of staying power over a meal.",Reserva,89,55.0,California,Cole Ranch,,Virginie Boone,@vboone,Esterlina 2009 Reserva Pinot Noir (Cole Ranch),Pinot Noir,Esterlina
256,South Africa,"A good value, this is an easy-pleasing Syrah with vibrant notes of red plum, cherry and blueberry. Fine, dusty tannins reminiscent of cocoa powder and dried crushed berries stay after swallow alongside a hint of sweet smoke flavor.",Goat-Roti,89,20.0,Coastal Region,,,Lauren Buzzeo,@laurbuzz,Goats do Roam Wine Co. 2008 Goat-Roti Syrah-Viognier (Coastal Region),Syrah-Viognier,Goats do Roam Wine Co.
257,South Africa,"This approachable Cabernet-based blend, which also has 18% Pinotage, 11% Cab Franc and 2% Shiraz, is a spicy and balanced red with notes of menthol, purple florals, black cherry and berry. With a mouthfeel like crushed velvet, a black pepper finish and an attractive price tag, it's a shame only 100 cases were produced.",The William,89,18.0,Coastal Region,,,Lauren Buzzeo,@laurbuzz,Graham Beck 2007 The William Red (Coastal Region),Red Blend,Graham Beck
258,South Africa,"This wine strikes a superb balance between herbaceous, green notes and ripe black fruit, all graced with a kiss of sweet vanilla. Rich blackberry and cassis flavors flood the palate, but then transition to sweet smoke and oak flavors on the finish.",,89,35.0,Stellenbosch,,,Lauren Buzzeo,@laurbuzz,Hartenberg 2007 Cabernet Sauvignon (Stellenbosch),Cabernet Sauvignon,Hartenberg
259,France,"Tannic yet balanced wine with a great swathe of perfumed fruit as well as dense black flavors. There is a herbal character as well as dark plum and sweet fruit flavors. Age for 2–3 years, the wine will always be firm.",Noir 46,89,13.0,Southwest France,Cahors,,Roger Voss,@vossroger,Vignobles 46N118 2007 Noir 46 Malbec (Cahors),Malbec,Vignobles 46N118
260,US,"Young, tart and wrapped up tight as a drum, this offers sharp flavors of cranberry and a bit of Campari. It has the heft and polish to open up further with some additional bottle age, but it isn't budging at the moment.",Estate,89,40.0,Oregon,Willamette Valley,Willamette Valley,Paul Gregutt,@paulgwine ,Willamette Valley Vineyards 2009 Estate Pinot Noir (Willamette Valley),Pinot Noir,Willamette Valley Vineyards
261,Argentina,"A blend of 50% Malbec with Cabernet, Syrah and Merlot that's lightly minty and full of tobacco, pepper and spicy aromas. Feels a bit clampy and tannic, with oaky, herbal flavors of plum and sweet berry. Shows a hint of green and drying tannins on the finish.",Estate Blend Gran Reserva,89,37.0,Mendoza Province,,,Michael Schachner,@wineschach,Algodon 2008 Estate Blend Gran Reserva Red,Red Blend,Algodon
262,US,"Beaver Creek makes a variation of Fairytale every vintage and this one, sourced from Napa Valley, is 41% Merlot, 36% Zinfandel and 23% Syrah, a mix that seems to work very nicely here. The wine's Zin almost tastes as if it has mountain tannins; the wine is overall herbal and earthy, ripe and sturdy with balanced fruit.",Fairytale,89,39.0,California,Napa Valley,Napa,Virginie Boone,@vboone,Beaver Creek 2008 Fairytale Red (Napa Valley),Red Blend,Beaver Creek
263,US,"A very good Pinot Noir, rich in cherry, licorice, cola and spice flavors that are wrapped into firm tannins. It's on the forward side, trading complexity and nuance in favor of immediate gratification. Drink now–2014.",Monument,89,60.0,California,Santa Maria Valley,Central Coast,,,Byron 2009 Monument Pinot Noir (Santa Maria Valley),Pinot Noir,Byron
264,South Africa,"A good amount of earthy spice, tea leaves and forrest floor lead the way on the nose, but the black cherry and berry fruit aromas follow shortly after with an additional accent of sweet cured meat. Medium weight and lush, the creamy mouth transitions into a finish loaded with sweet spice and bittersweet cocoa.",,89,19.0,Stellenbosch,,,Lauren Buzzeo,@laurbuzz,Jardin 2007 Syrah (Stellenbosch),Syrah,Jardin
265,South Africa,"Fairly intense and flavorful, this Chard expresses assertive aromas and flavors of wood-grilled peaches, buttercream frosting, lemon custard and toasted brioche. Medium weight in the mouth with good balance and a touch of baking spice on the close.",Nine Yards,89,40.0,Stellenbosch,,,Lauren Buzzeo,@laurbuzz,Jardin 2009 Nine Yards Chardonnay (Stellenbosch),Chardonnay,Jardin
266,Argentina,"For an under-$15 red blend, Corte has it going on. It's rich and full, almost syrupy on the nose, with lots of oak, ink and vanilla. Shows power and packs a punch, with dark berry, chocolate and spicy flavors. A little tannic and scratchy, but with structure and framework to spare. Malbec (80%), with Bonarda and Petit Verdot.",Corte Malbec-Bonarda-Petit Verdot,89,14.0,Mendoza Province,Mendoza,,Michael Schachner,@wineschach,Kaiken 2008 Corte Malbec-Bonarda-Petit Verdot Red (Mendoza),Red Blend,Kaiken
267,Italy,"This vineyard-designate blend of Trebbiano and Grechetto opens with a luminous golden color and elegant aromas of stone fruit, citrus, Golden Delicious apple and mature pear. There's a pretty hint of vanilla and almond butter at the back.",Torre di Giano Vigna il Pino,89,40.0,Central Italy,Torgiano,,,,Lungarotti 2007 Torre di Giano Vigna il Pino White (Torgiano),White Blend,Lungarotti
268,Italy,"This sophisticated white wine from the homeland of Italy's most robust reds (Ripasso and Amarone) shows a full, generous appearance with a golden-amber color. Stone fruit, toasted almond and candied lemon give it heft and consistency.",Terso,89,36.0,Veneto,Veneto,,,,Marchesi Fumanelli 2005 Terso White (Veneto),White Blend,Marchesi Fumanelli
269,Austria,"Smooth and ripe, this is a rich black-fruited wine, its tannins comfortably ensconsed in a rich cushion. There is acidity to balance and spice which, along with the full-bodied fruit character, makes the wine ready to drink now.",,89,17.0,Leithaberg,,,Roger Voss,@vossroger,Mariell 2009 Blaufränkisch (Leithaberg),Blaufränkisch,Mariell
270,Italy,"A gorgeous expression of Friulano, this wine (in a screwcap bottle) makes an elegant addition to chicken, pasta or seafood dinners. Layers of peach, almond and pineapple are wrapped tightly together.",,89,25.0,Northeastern Italy,Colli Orientali del Friuli,,,,Livio Felluga 2009 Friulano (Colli Orientali del Friuli),Friulano,Livio Felluga
271,Greece,"Lively aromas of lemon, grapefruit and melon start this white from Greece. Flavors of grapefruit and lemon rind are fresh and crisp but still offer dimension. The finish is spicy and clean. A great food wine: pair with grilled fish or clams.",,89,15.0,Santorini,,,Susan Kostrzewa,@suskostrzewa,My Big Fat Greek Wine 2010 Assyrtico (Santorini),Assyrtico,My Big Fat Greek Wine
272,Italy,"This partially oak-aged expression of Pinot Bianco from cool-climate Alto Adige (in the far north of Italy) offers a lovely texture that is creamy and smooth at the same time. Measured aromas include melon, apricot, grapefruit and a touch of vanilla spice.",Sirmian,89,26.0,Northeastern Italy,Alto Adige,,,,Nals Margreid 2010 Sirmian Pinot Bianco (Alto Adige),Pinot Bianco,Nals Margreid
273,Argentina,"Leather, berry, earth, raisin and roasted qualities define the nose on this Tempranillo-led blend of four grapes. Feels good in the mouth, with active raspberry, plum and coffee flavors that comes with a roasted accent. Mildly leafy, baked and woody on the thorough finish.",B Crux,89,19.0,Mendoza Province,Uco Valley,,Michael Schachner,@wineschach,O. Fournier 2007 B Crux Red (Uco Valley),Red Blend,O. Fournier
274,Italy,"This is a gorgeous Italian white from northern Italy that boasts fragrant tones of spring flower and chopped herb backed by peach, honey and white almond. It's crisp, intense and would be perfect with basil Thai curry.",Estrosa,89,13.0,Piedmont,Monferrato,,,,Pico Maccario 2010 Estrosa White (Monferrato),White Blend,Pico Maccario
275,Argentina,"A medium-weight Cabernet with plum, prune, tobacco and herb aromas. Features average weight and body, with a creamy texture and layered flavors of black fruit, raspberry and spice. Finishes with herb and plum notes as well as a pinch of tobacco.",Reserva de Familia,89,30.0,Mendoza Province,Mendoza,,Michael Schachner,@wineschach,Sottano 2009 Reserva de Familia Cabernet Sauvignon (Mendoza),Cabernet Sauvignon,Sottano
276,US,"A huge, kick butt Zinfandel, packed with sweet berry, bacon, black pepper and smoky cedar flavors. There's absolutely nothing shy about it. Packs a real punch all the way through to the spicy finish. Good price for a Sonoma Zin this classic.",Old Vines,89,20.0,California,Sonoma County,Sonoma,,,St. Francis 2009 Old Vines Zinfandel (Sonoma County),Zinfandel,St. Francis
277,US,"Quite a good Cabernet, showing the elegance and ripe fruitiness you expect from Napa, in a style for drinking now. Drily tannic, it shows classic blackberry and blueberry flavors.",,89,30.0,California,Napa Valley,Napa,,,Trailhead 2010 Cabernet Sauvignon (Napa Valley),Cabernet Sauvignon,Trailhead
278,US,"Fruity, forward and quite refreshing, this has appealing black cherry fruit with a light candy flavor. The balancing tannins add sufficient depth and weight to allow this a few more years in the cellar.",Bishop Creek,89,50.0,Oregon,Willamette Valley,,Paul Gregutt,@paulgwine ,Erath 2009 Bishop Creek Pinot Noir,Pinot Noir,Erath
279,Italy,"This oak-fermented Sauvignon (in an artsy, screwcap bottle) delivers a rich, spicy finish and thick layers of peach, citrus, tomato leaf and honey-like aromas. It's a gorgeous wine that is an absolute pleasure to drink.",,89,52.0,Northeastern Italy,Alto Adige,,,,Franz Haas 2009 Sauvignon (Alto Adige),Sauvignon,Franz Haas
280,Austria,"A strongly spicy, rich wine, this has great concentration and an intense, dense texture.There is weight with plenty of ripe tropical fruits to contrast pronounced black pepper and bitter almond character. It's still young, so don't drink before 2015. Screwcap.",Schiefer Reserve,92,24.0,Kremstal,,,Roger Voss,@vossroger,Forstreiter 2012 Schiefer Reserve Grüner Veltliner (Kremstal),Grüner Veltliner,Forstreiter
281,US,"This is another fine Pinot from Cambria, showing the winery's great price-quality ratio. Words like opulent and elegant come to mind to describe intense flavors of black cherries, licorice, cola, herb tea and Indian spices. It's bone dry, and also quite tannic, but you can enjoy it now with big, rich lamb and beef dishes, or a wild mushroom risotto. Otherwise, it will continue to improve for at least eight years.",Bench Break Vineyard,92,34.0,California,Santa Maria Valley,Central Coast,,,Cambria 2011 Bench Break Vineyard Pinot Noir (Santa Maria Valley),Pinot Noir,Cambria
282,Italy,"This delicious blend of Cabernet Sauvignon, Merlot and Petit Verdot opens with an intense, brooding fragrance of dark fruit, spice and leather. The palate delivers a concentrated black-cherry flavor that's framed by big, chewy tannins and  punctuated by spicy accents of white and black pepper, licorice and pipe. Drink 2015–2024.",Dulcamara,92,41.0,Tuscany,Toscana,,Kerin O’Keefe,@kerinokeefe,I Giusti e Zanza 2009 Dulcamara Red (Toscana),Red Blend,I Giusti e Zanza
283,US,"Bella Vida replaces the Abbey Ridge bottling and does so with pizzazz. The best of the 2011 releases, this is a beautiful expression of grapes grown on red clay soils, with refined, deeply penetrating flavors of ripe raspberries. Smooth, supple and long, with uncommon purity, it finishes with a kiss of chocolate from 18 months in one-quarter new oak barrels.",Bella Vida Vineyard Unfiltered,92,52.0,Oregon,Dundee Hills,Willamette Valley,Paul Gregutt,@paulgwine ,J. Christopher 2011 Bella Vida Vineyard Unfiltered Pinot Noir (Dundee Hills),Pinot Noir,J. Christopher
284,Argentina,"This huge Malbec defines jammy and concentrated. The bouquet is ripe, soft and minty, while the palate echoes the nose with thickness and density. Flavors of prune, raisin, tea and blackberry are borderline syrupy, while the finish is smooth and pure but doesn't offer much spine or foundation. Drink this modern Malbec sooner rather than later.",Marchiori Vineyard Block C2,92,215.0,Mendoza Province,Perdriel,,Michael Schachner,@wineschach,Viña Cobos 2011 Marchiori Vineyard Block C2 Malbec (Perdriel),Malbec,Viña Cobos
285,Austria,"This is a very aromatic wine that's rich, spicy and with just a touch of ripeness. It has spiced pear, lychee and honey notes all balanced by a wonderful fresh acidity. Drink now and until 2020. Screwcap.",Steiner Kögl Erste Lage,92,,Kremstal,,,Roger Voss,@vossroger,Salomon-Undhof 2011 Steiner Kögl Erste Lage Riesling (Kremstal),Riesling,Salomon-Undhof
286,US,"While delicious now with flavors of raspberries, cherries, cola and oak, all showered with tart, citrusy acidity, this wine also has a great future. Give it 6–8 years to evolve in the bottle for further complexity.",Rincon Vineyard,92,60.0,California,Arroyo Grande Valley,Central Coast,,,Talley 2011 Rincon Vineyard Pinot Noir (Arroyo Grande Valley),Pinot Noir,Talley
287,Spain,"This is the stud in the Acústic stable. A blend of 70% Carignan and 30% Garnacha, Braó is lively and bright on the nose, with ripe blackberry and cassis aromas. The palate is concentrated and juicy, with fine balance and bold flavors of blueberry, blackberry and coffee. A toasty, dark finish features chocolate, toast and minerality. Drink through 2019.",Braó Vinyes Velles,92,40.0,Catalonia,Montsant,,Michael Schachner,@wineschach,Acústic 2010 Braó Vinyes Velles Carignan-Grenache (Montsant),Carignan-Grenache,Acústic
288,Austria,"While it feels rich and round, this is also a wine with a crisp side to it. Acidity cuts through ripe pear, apricot and lychee flavors, giving a decidedly crisp balance. It's a wine that is already ready to drink. Screwcap.",Kremser Gebling Erste Lage,92,,Kremstal,,,Roger Voss,@vossroger,Josef Schmid 2011 Kremser Gebling Erste Lage Grüner Veltliner (Kremstal),Grüner Veltliner,Josef Schmid
289,US,"This 100% Cabernet Sauvignon is so rich and decadent, with milk chocolate, blackberry and new French oak flavors. Made by celebrity winemaker Philippe Melka, it's soft and approacheable on the palate and widely appealing. Your best bet is to drink up now.",Fortune Teller,92,125.0,California,Napa Valley,Napa,,,Parallel 2010 Fortune Teller Cabernet Sauvignon (Napa Valley),Cabernet Sauvignon,Parallel
290,France,"This is a wine that has great potential—you can tell from the firm tannins, tight acidity and closed texture. Initially, black currant flavors are touched with dark, dusty notes, but they finish with more juicy character on the afterntaste. Drink from 2017.",,92,,Bordeaux,Saint-Estèphe,,Roger Voss,@vossroger,Château Lafon-Rochet 2011  Saint-Estèphe,Bordeaux-style Red Blend,Château Lafon-Rochet
291,Italy,"This powerful Sagrantino opens with aromas of meat juice, truffle and black fruit. The palate offers blackberry, black cherry, cinnamon and black pepper, along with tobacco notes. It also has Sagrantino's trademark tannic backbone, but the tannins are ripe and are balanced by bright acidity.",,92,,Central Italy,Sagrantino di Montefalco,,Kerin O’Keefe,@kerinokeefe,Dionigi 2006  Sagrantino di Montefalco,Sagrantino,Dionigi
292,France,"Rich almonds, ripe peaches and a smoky, oxidized character all come together in this ripe, complex, fascinating wine. There is a great tang of apple acidity on the finish. Drink now.",Vin Jaune,92,45.0,France Other,Arbois,,Roger Voss,@vossroger,Domaine Daniel Dugois 2006 Vin Jaune Savagnin (Arbois),Savagnin,Domaine Daniel Dugois
293,Australia,"This wine displays ample concentration in its inky color and potent aromas of dark berry fruit. There's a hint of raisining as well. In the mouth, it's mouthfilling but lacks a bit of texture; the flavors include dark plums, vanilla and hints of dried fruits, like figs and dates. With a finish that calls to mind chocolate fudge (minus the sugar), opt for drinking this wine over the relatively near term, now to 2020.",Green's Vineyard,92,70.0,South Australia,Barossa Valley,,Joe Czerwinski,@JoeCz,Kilikanoon 2009 Green's Vineyard Shiraz (Barossa Valley),Shiraz,Kilikanoon
294,Argentina,"Deep, lush aromas of black fruits, graphite and coconut are welcoming and friendly. The mouthfeel is pure and smooth, with elegance and power. Flavors of cassis, blackberry, hard spices and licorice filter into a long, mellow, classy finish. This is a pushy, full-bodied wine that doesn't throw punches; drink through 2020.",Synthesis,92,30.0,Mendoza Province,Tupungato,,Michael Schachner,@wineschach,Finca Sophenia 2011 Synthesis Malbec (Tupungato),Malbec,Finca Sophenia
295,US,"This blend showcases the soft lusciousness and ripe fruit of Paso Robles. It's rich and sweet in jammy blackberries, cherries, chocolate and spicy sandalwood. Drink now.",Treana Red,87,35.0,California,Paso Robles,Central Coast,,,Treana 2008 Treana Red Cabernet Sauvignon-Syrah (Paso Robles),Cabernet Sauvignon-Syrah,Treana
296,Chile,"Rooty and leafy on the nose, with red berry aromas peeking through some obvious oak. The palate offers cherry and raspberry flavors along with sweetness, and things are backed by vanilla and chocolate. Good, tasty and oaky, with proper layering.",Grey [Glacier] Single Block Trinidad Vineyard,87,20.0,Maipo Valley,,,Michael Schachner,@wineschach,Ventisquero 2008 Grey [Glacier] Single Block Trinidad Vineyard Cabernet Sauvignon (Maipo Valley),Cabernet Sauvignon,Ventisquero
297,US,"This is a soft, gentle Cabernet for drinking now. It's pleasantly rich, offering blackberry, cherry, chocolate and cedar flavors, wrapped into easy tannins.",,87,15.0,California,Napa Valley,Napa,,,Aquinas 2008 Cabernet Sauvignon (Napa Valley),Cabernet Sauvignon,Aquinas
298,Chile,"Foresty and dark on the bouquet, with aromas of licorice, prune, forest and foxiness. The palate is full and tannic, while flavors run sweet, creamy and slightly syrupy, with chocolate and spiced fig notes. Finishes rich and rough, with dry herbs and true Chilean Cab flavors of olive and oregano.",,87,19.0,Aconcagua Valley,,,Michael Schachner,@wineschach,Arboleda 2009 Cabernet Sauvignon (Aconcagua Valley),Cabernet Sauvignon,Arboleda
299,Italy,"Pinay is a tight and defined red blend from northern Italy with bright accents of cherry cola, forest berry, licorice and dark mineral. There's a sharp, sour note on the close that would pair with smoked cheese.",Pinay,87,,Piedmont,Langhe,,,,Attilio Ghisolfi 2007 Pinay Red (Langhe),Red Blend,Attilio Ghisolfi
300,US,"Soft, light in body and easy to drink, this Sangiovese, from the Napa estate vineyard, is delicious in raspberry, red currant, licorice, bacon and spice flavors. It's somewhat ephemeral, an instantly pleasant wine to drink especially with cured meats, olives, hard cheeses.",Estate,87,28.0,California,Napa Valley,Napa,,,Benessere 2007 Estate Sangiovese (Napa Valley),Sangiovese,Benessere
301,US,"A good, clean, tart and lightly spicy all-stainless style. Cool climate fruit puts the accent on lime and lemon flavors, keeps the alcohol low (13.3%), and makes this a fine match to shellfish, white fish and light pasta dishes.",Whiteline No Oak,87,14.0,Washington,Columbia Valley (WA),Columbia Valley,Paul Gregutt,@paulgwine ,Buried Cane 2009 Whiteline No Oak Chardonnay (Columbia Valley (WA)),Chardonnay,Buried Cane
302,Italy,"This fresh Nebbiolo-based Roero from Cantina dei Nebbiolo offers pretty intensity with aromas of tar, licorice and a touch of sweet cherry liqueur. There isn't much pulp or meat here but the finish is both crisp and tart.",,87,,Piedmont,Roero,,,,Cantina del Nebbiolo 2008  Roero,Nebbiolo,Cantina del Nebbiolo
303,Italy,"Slightly disjointed at first, this Barolo with fruit sourced from four vineyard sites, needs a few minutes to open in the glass. The wine offers tertiary aromas of cured beef, smoked bacon and white mushroom. Drink now.",4 Vigne,87,56.0,Piedmont,Barolo,,,,Cascina Adelaide 2005 4 Vigne  (Barolo),Nebbiolo,Cascina Adelaide
304,Italy,This aged expression from the Nizza subzone of Asti offers tertiary aromas of dried tobacco and dried prune. The variety's characteristic acidity kicks in on the finish.,Vignassa,87,,Piedmont,Barbera d'Asti Superiore Nizza,,,,Cascina La Ghersa 2004 Vignassa  (Barbera d'Asti Superiore Nizza),Barbera,Cascina La Ghersa
305,US,"Muted at first, this wine opens up nicely with time. Sweet, ripe and easy on the finish, its core is full of black pepper and clove. The grapes are sourced from several distinctive vineyards in Mendocino County. Drink it with a steak.",,87,24.0,California,Mendocino County,,Virginie Boone,@vboone,Claudia Springs 2007 Zinfandel (Mendocino County),Zinfandel,Claudia Springs
306,Romania,"Fragrant on the nose with fresh orange, lemon and honeysuckle aromas, this full-bodied Chard is deliciously quaffable with a concentrated apple palate and just a hint of buttered toast. Another well-made Romanian at an unbeatable bargain price.",,87,7.0,Recas,,,Anna Lee C. Iijima,,Cramele Recas 2009 Chardonnay (Recas),Chardonnay,Cramele Recas
307,France,"Rich and full in the mouth, packed with red fruits and black cherries. The wine is sweet, while keeping a tannic core. Drink next year.",Les Dames Huguettes,87,30.0,Burgundy,Côte de Nuits-Villages,,Roger Voss,@vossroger,Domaine Bertagna 2009 Les Dames Huguettes  (Côte de Nuits-Villages),Pinot Noir,Domaine Bertagna
308,Greece,"This fuller-bodied white blend offers pineapple, kiwi and citrus on the nose, and a blend of full fruit and acidity on the palate. A balanced, easygoing white that is perfect for everyday poultry, vegetable and fish meals.",Asirtiko Athiri,87,18.0,Santorini,,,Susan Kostrzewa,@suskostrzewa,Domaine Sigalas 2010 Asirtiko Athiri White (Santorini),White Blend,Domaine Sigalas
309,Italy,Here's a fun and slightly less formal expression of Nebbiolo (especially when compared to the great wines of Barbaresco and Barolo) that offers tight fruit nuances of white cherry and forest berry backed by light shadings of spice and smoke.,,87,20.0,Piedmont,Langhe,,,,Socré 2006 Nebbiolo (Langhe),Nebbiolo,Socré
310,Italy,"Aged 12 months in large oak casks, this bright Nebbiolo offers pretty aromas of small berry, tar, licorice and cigar smoke backed by tight intensity and structure. Pair this powerful wine with braised quail or pork tenderloin.",,87,18.0,Piedmont,Langhe,,,,Boffa 2006 Nebbiolo (Langhe),Nebbiolo,Boffa
311,New Zealand,"This wine is light in color, but still packs a mouthful of flavor. It's peppery and meaty upfront, filled out on the midpalate by tart fruit that verges on cranberry in flavor. Pretty rather than potent; drink now-2014.",,87,18.0,Hawke's Bay,,,Joe Czerwinski,@JoeCz,Otto's Constant Dream 2008 Syrah (Hawke's Bay),Syrah,Otto's Constant Dream
312,US,"A good wine to drink now for its sweet, ripe berry and mocha flavors and smoky coat of oak. It has smooth tannins and a spicy finish. Give it a good decant to let it breathe for a few hours.",,87,40.0,California,Napa Valley,Napa,,,Mount Veeder 2008 Cabernet Sauvignon (Napa Valley),Cabernet Sauvignon,Mount Veeder
313,Italy,"Roero Rabino is accented by sweet touches of cinnamon and nutmeg that are offset by cassis, dried blueberry, leather and tobacco. This sturdy red wine presents a very nice ensemble that is capped by a tight, astringent close.",,87,,Piedmont,Roero,,,,Rabino 2008  Roero,Nebbiolo,Rabino
314,US,"With rich, sweet blackberry and cocoa flavors, this is a very nice Cabernet for drinking with a good meal. It's a little rough around the edges, with jaggy tannins. Ready now.",,87,28.0,California,Napa Valley,Napa,,,Robert Mondavi 2008 Cabernet Sauvignon (Napa Valley),Cabernet Sauvignon,Robert Mondavi
315,Italy,"Honey, almond blossom and citrus zest are followed by creamy foam and tonic acidity. This is an easygoing Prosecco that offers a light and compact structure and bright flavors of lime and green fruit.",Extra Dry,86,15.0,Veneto,Prosecco di Valdobbiadene,,,,Bellussi NV Extra Dry  (Prosecco di Valdobbiadene),Prosecco,Bellussi
316,France,"An intriguing blend of Sauvignon Blanc and Muscadelle, which highlights the herbaceous Sauvignon character and a more perfumed Muscadelle. The two give a fresh, citrus- and pineapple-flavored wine, lively, to be enjoyed young.",Les Amants Mont-Pérat,86,,Bordeaux,Bordeaux Blanc,,Roger Voss,@vossroger,Château Mont-Pérat 2008 Les Amants Mont-Pérat  (Bordeaux Blanc),Bordeaux-style White Blend,Château Mont-Pérat
317,France,"Soft, ripe, dominated by peaches, pears and a rounded, toasty character. The spice is dominant, giving the wine an exotic edge. The more rounded style gives concentration as well as a fine, finishing velvet texture.",,86,,Bordeaux,Bordeaux Blanc,,Roger Voss,@vossroger,Château Tour de Mirambeau 2006  Bordeaux Blanc,Bordeaux-style White Blend,Château Tour de Mirambeau
