,country,description,designation,points,price,province,region_1,region_2,taster_name,taster_twitter_handle,title,variety,winery
507,US,"Medium bodied, this sharply defined wine brings in plenty of notes of herb, root and earth around its light berry fruit. It captures the defining flavors of Wahluke Slope Syrah in a somewhat muted style, reflecting the abbreviated growing season.",Clifton Vineyard,87,28.0,Washington,Wahluke Slope,Columbia Valley,Paul Gregutt,@paulgwine ,Camaraderie 2009 Clifton Vineyard Syrah (Wahluke Slope),Syrah,Camaraderie
508,US,"This is a mix of fruit from both warm and cool vineyards, crafting a clean, fresh, lightly herbal wine with a pleasing dusty character. Hints of cocoa and toast annotate the tart berry fruit, with a thread of smoke and chalk running through the tannins.",,87,28.0,Washington,Yakima Valley,Columbia Valley,Paul Gregutt,@paulgwine ,Camaraderie 2009 Tempranillo (Yakima Valley),Tempranillo,Camaraderie
509,US,"This would be a straightforward Bordeaux red blend if not for the 5% Petite Sirah within. Together, it's 74% Cabernet Sauvignon, 12% Merlot, 7% Cabernet Franc and 2% Malbec as well, sourced from Howell Mountain and valley floor sites. Dusty and herbal, the wine is thick and sizably tannic, with dense black fruit, leather and coffee.",Quantum,91,65.0,California,Napa Valley,Napa,Virginie Boone,@vboone,Beringer 2014 Quantum Red (Napa Valley),Red Blend,Beringer
510,US,"Flint and smoke aromas show strongly on this bottling, alongside hints of lemon balm and a rustic apple cider vinegar savory kick. Tangy smoked tangerine flavors show on the energized sip, where a unique sandalwood smoky quality plays with more cider-like tang.",Coastview Vineyard,91,48.0,California,Monterey County,Central Coast,Matt Kettmann,@mattkettmann,Big Basin 2014 Coastview Vineyard Chardonnay (Monterey County),Chardonnay,Big Basin
511,France,"This potentially rich Champagne is still young. The Chardonnay and Pinot Noir that dominate the blend show tight acidity, minerality and a tangy, orange-like edge. Give it time to mature, and it will be splendid.",Cuvée St Clément,91,70.0,Champagne,Champagne,,Roger Voss,@vossroger,Boude Baudin 2010 Cuvée St Clément  (Champagne),Champagne Blend,Boude Baudin
512,France,"Aged for an extra two years to soften its tense acidity, this Champagne is defiantly bone-dry yet not searing. Its ripe and rich fruitiness cushions the crisp acidity and taut, nervy citrus character. Drink now.",B. Zéro Brut Dosage,91,59.0,Champagne,Champagne,,Roger Voss,@vossroger,Boude Baudin NV B. Zéro Brut Dosage  (Champagne),Champagne Blend,Boude Baudin
513,US,"Big tannins support the layers of extracted, concentrated fruit that leans red into cherry, cassis and currant. Char and vanilla speak for the oak.",El Adobo Ranch Vineyard,91,90.0,California,Chiles Valley,Napa,Virginie Boone,@vboone,Conn Creek 2013 El Adobo Ranch Vineyard Cabernet Sauvignon (Chiles Valley),Cabernet Sauvignon,Conn Creek
514,Chile,"Baked blueberry and boysenberry aromas are more ripe than delicate. This Merlot is saturated and deeply tannic. Flavors of coffee, chocolate and lemon peel precede a toasty finish that overflows with chocolaty oak and lingering tannins. Drink through 2023.",20 Barrels Limited Edition Peralillo Estate,91,35.0,Colchagua Valley,,,Michael Schachner,@wineschach,Cono Sur 2012 20 Barrels Limited Edition Peralillo Estate Merlot (Colchagua Valley),Merlot,Cono Sur
515,US,"Delicate in cranberry and strawberry, this wine is highlighted in uplifted acidity and plenty of length and breadth within its medium-bodied structure. A pleasing streak of cardamom is consistent throughout, as accents of forest floor and cola figure in.",Silver Eagle Vineyard,91,75.0,California,Sonoma Coast,Sonoma,Virginie Boone,@vboone,D.R. Stephens 2014 Silver Eagle Vineyard Pinot Noir (Sonoma Coast),Pinot Noir,D.R. Stephens
516,US,"This is a relatively thick and dense wine, grippy in tannin and oak at first, youthful and desiring of time and air. Beyond its strength, its shows the beginnings of delicacy and grace, commingling raspberry with clove and tea.",Soul Patch Estate Grown,91,55.0,California,Russian River Valley,Sonoma,Virginie Boone,@vboone,Davis Family 2014 Soul Patch Estate Grown Pinot Noir (Russian River Valley),Pinot Noir,Davis Family
517,US,"This is a soft, smooth and earthy wine, still unraveling from its youth, that's crisp and fresh in acidity. Chewy still in texture, it offers a glorious celebration of red cherry, rhubarb, tea and clove.",Starr Ridge Vineyard,91,55.0,California,Russian River Valley,Sonoma,Virginie Boone,@vboone,Davis Family 2014 Starr Ridge Vineyard Pinot Noir (Russian River Valley),Pinot Noir,Davis Family
518,France,"From a walled vineyard once owned by the local bishop, this wine is structured and firm while also having great red cherry and berry fruit. It's one of a number of Premier Crus from this producer—and certainly the most expressive with its generous fruit and balanced tannins. Drink from 2018.",Le Clos l'Evêque Premier Cru,91,60.0,Burgundy,Mercurey,,Roger Voss,@vossroger,Domaine Jeannin-Naltet 2014 Le Clos l'Evêque Premier Cru  (Mercurey),Pinot Noir,Domaine Jeannin-Naltet
519,US,"Deliciously fruity but also well-structured, this full-bodied wine has excellent concentration and good balance. Effusive aromas of blueberry and black cherry lead to opulent but not overripe berry flavors that are lightly accented by clove and cinnamon nuances.",The Brat,91,36.0,California,Calaveras County,Sierra Foothills,Jim Gordon,@gordone_cellars,Prospect 772 2014 The Brat Grenache (Calaveras County),Grenache,Prospect 772
520,US,"Bob Lindquist is almost certainly the only vintner in America that is drying Marsanne on straw mats to make a dessert wine. The result is aromas of Asian pear, white peach, baked apple and baking spice, more fresh rather than sweet. It is viscous on the sip, and the sweetness steadily grows on the palate, offering cotton candy flavors. Fascinating stuff.",Doux Sawyer Lindquist Vineyard,91,35.0,California,Edna Valley,Central Coast,Matt Kettmann,@mattkettmann,Qupé 2013 Doux Sawyer Lindquist Vineyard Marsanne (Edna Valley),Marsanne,Qupé
521,US,"This is a delicate yet flavorful take on this grape, from a biodynamic, cool-climate vineyard. Light red plum and hibiscus aromas meet with sweet herbs and cinnamon spice on the nose. The lithe palate offers candied strawberry with thyme, anise and touches of garden herbs, with that red fruit flavor carrying deep into the finish. Would pair great with spicy food.",Sawyer Lindquist Vineyard,91,35.0,California,Edna Valley,Central Coast,Matt Kettmann,@mattkettmann,Qupé 2013 Sawyer Lindquist Vineyard Grenache (Edna Valley),Grenache,Qupé
522,US,"The Sims is amped up in 2014, dark and thick and showing a roasted character. Mocha, black tea and Kahlua flavors push the palate into a gritty charred mode. It's delicious, liquorous, and suitable for smoky ribs or a juicy burger. Drink now through 2020.",Sims Vineyard,91,55.0,Oregon,Willamette Valley,Willamette Valley,Paul Gregutt,@paulgwine ,Rex Hill 2014 Sims Vineyard Pinot Noir (Willamette Valley),Pinot Noir,Rex Hill
523,US,"There's a whiff of volatility upon opening, then a rush of bright, tangy orange and cherry fruit. The 20% new oak aging does not really come through in scent or flavor. Though not in any way effervescent, this young release carries an impression of carbonation in the finish. Give it another year or two of bottle age and drink after 2019.",Steve's Reserve,91,65.0,Oregon,Chehalem Mountains,Willamette Valley,Paul Gregutt,@paulgwine ,Ruby 2015 Steve's Reserve Pinot Noir (Chehalem Mountains),Pinot Noir,Ruby
524,US,"Wood spice, cherry and herb aromas are followed by luscious cherry flavors. It keeps you coming back for more with a high yum factor.",Wallula,91,35.0,Washington,Horse Heaven Hills,Columbia Valley,Sean P. Sullivan,@wawinereport,Structure 2014 Wallula Syrah (Horse Heaven Hills),Syrah,Structure
525,US,"There's an expert balance between lightly melted butter, pithy Meyer lemon and toasted marcona almond on the nose of this bottling from the region's iconic vineyard. The palate is wound up tightly, offering good grip and lots of textural length while showing flavors of chamomile, saffron, sea salt and more Meyer lemon rinds.",Rincon Vineyard,91,49.0,California,Arroyo Grande Valley,Central Coast,Matt Kettmann,@mattkettmann,Testarossa 2015 Rincon Vineyard Chardonnay (Arroyo Grande Valley),Chardonnay,Testarossa
526,US,"Just 8% of this reserve spent time in new oak, putting the emphasis on juicy jammy flavors of cranberry fruit. It rolls into sour cherry, some citrus and a most refreshing, clean and vivid mouthfeel. Drink now and into the mid-2020s.",Prince Hill Vineyard Reserve,91,55.0,Oregon,Dundee Hills,Willamette Valley,Paul Gregutt,@paulgwine ,Tumwater 2014 Prince Hill Vineyard Reserve Pinot Noir (Dundee Hills),Pinot Noir,Tumwater
527,Germany,"A surprising whiff of black currant on the nose of this elegant white points to Scheurebe—one of Germany's lesser-known grapes. Wittmann's version is particularly poised, offering loads of peach and grapefruit flavors, sharply contrasted by zesty lime and mineral tones. The finish is long and sleek, touched by a hint of bee pollen.",Trocken,91,30.0,Rheinhessen,,,Anna Lee C. Iijima,,Wittmann 2015 Trocken Scheurebe (Rheinhessen),Scheurebe,Wittmann
528,France,"This producer shows its preference for dry Champagnes with this bone-dry, oak-fermented bottling. With its bottle age and the softening effect of wood, it's generous and gently textured, leaving plenty of room for its bright fruit and balanced acidity to show. Drink from 2018.",Brut Zéro Sélection,91,42.0,Champagne,Champagne,,Roger Voss,@vossroger,Jeaunaux-Robin NV Brut Zéro Sélection  (Champagne),Champagne Blend,Jeaunaux-Robin
529,US,"From the sought-after site on Westside Road, this wine delivers a nuanced, elegant expression of juicy red cherry, plum, pomegranate and light, compelling spice. With a depth of body and soft, integrated tannin, it's complex without being overpowering, finishing in a mix of sautéed mushroom and forest floor.",Bucher Vineyard,91,45.0,California,Russian River Valley,Sonoma,Virginie Boone,@vboone,Joseph Jewell 2014 Bucher Vineyard Pinot Noir (Russian River Valley),Pinot Noir,Joseph Jewell
530,Chile,"Jammy berry aromas seem reduced at first, with notes of iodine and rubber. But with airing this packed Syrah comes around. A flush saturated tannic palate is home to toasty blackened berry, coffee and spice flavors. On the finish, burnt toast and espresso flavors don't slip. Drink through 2022.",Cuvée Alexandre Apalta Vineyard Made With Organic Grapes,91,24.0,Colchagua Valley,,,Michael Schachner,@wineschach,Lapostolle 2013 Cuvée Alexandre Apalta Vineyard Made With Organic Grapes Syrah (Colchagua Valley),Syrah,Lapostolle
531,US,"One of a crop of new Oregon sparklers, this was barrel fermented with native yeast and aged for 56 months prior to disgorging. Fine tiny bubbles and a fresh, yeasty aroma introduce the wine, which has excellent concentration. Green apple and green banana, a touch of cucumber and a nice toasty frame all combine gracefully. The odds are that this will continue to improve in bottle for another five years at least.",Blanc de Noir,91,50.0,Oregon,Oregon,Oregon Other,Paul Gregutt,@paulgwine ,Le Cadeau 2011 Blanc de Noir Sparkling (Oregon),Sparkling Blend,Le Cadeau
532,US,"Scott Shull (Raptor Ridge) consults here. This brings a blend of clones from the estate vineyard, with ample new wood still showing through. Black fruits and a vein of coffee are also in the mix, with a balanced, somewhat muscular mouthfeel. This has the strength to stand up to a lightly blackened grilled seafood filet.",Diversité,91,50.0,Oregon,Willamette Valley,Willamette Valley,Paul Gregutt,@paulgwine ,Le Cadeau 2015 Diversité Pinot Noir (Willamette Valley),Pinot Noir,Le Cadeau
533,US,"Slightly liquorous when first opened, this pushes the alcohol up towards a place where some of the nuances are lost. But it has plenty of flavor, power and punch. Black coffee, black cherry, black olive and black licorice are entwined here, with some heat in the follow-through. Give it a good decanting and it will start to smooth out.",Équinoxe,91,50.0,Oregon,Willamette Valley,Willamette Valley,Paul Gregutt,@paulgwine ,Le Cadeau 2015 Équinoxe Pinot Noir (Willamette Valley),Pinot Noir,Le Cadeau
534,US,"Black plum, charred wood, coffee syrup and cracked black pepper show on the excellently bright nose of this bottling. The flavors are equally intriguing, with umami touches of charred beef along with rosemary, bay leaf, olie and more black pepper.",Di Domenico,91,38.0,California,Paso Robles,Central Coast,Matt Kettmann,@mattkettmann,Le Vigne 2014 Di Domenico Cabernet Sauvignon (Paso Robles),Cabernet Sauvignon,Le Vigne
535,Germany,"Fresh green apple and grapefruit aromas are bolstered on the palate of this dry, elegantly balanced Riesling. It's light bodied yet delightfully creamy. A kiss of tangerine zest marks its moderately long finish.",Trocken,91,22.0,Mosel,,,Anna Lee C. Iijima,,Maximin Grünhäuser 2015 Trocken Riesling (Mosel),Riesling,Maximin Grünhäuser
536,US,"Merlot (63%) takes the lead on this blend followed by Cabernet Sauvignon (23%) and Cabernet Franc. The aromas seem somewhat wound up at present, with notes of wood spice, vanilla and fresh herb. The palate is über-smooth, showing a fine sense of balance and polish.",,91,50.0,Washington,Walla Walla Valley (WA),Columbia Valley,Sean P. Sullivan,@wawinereport,Northstar 2013 Red (Walla Walla Valley (WA)),Bordeaux-style Red Blend,Northstar
537,US,"A 100% varietal wine, this offers upfront structure and gravelly texture, its tannins robust. The medium-bodied ripeness allows plenty of room for dried herb and cedar, accents to the bolder notions of black raspberry jam and coffee.",,91,110.0,California,Napa Valley,Napa,Virginie Boone,@vboone,Padis 2012 Cabernet Sauvignon (Napa Valley),Cabernet Sauvignon,Padis
538,US,"This is sourced from 30-year-old Wädenswil vines from a vineyard in the Elkton AVA. It's complex and compelling, showing layers of stone, strawberry, citrus, chocolate and sassafras. It's an elegant wine, well proportioned and modest in scope, but delicious.",Bradley Vineyard,91,45.0,Oregon,Umpqua Valley,Southern Oregon,Paul Gregutt,@paulgwine ,Paul O'Brien 2014 Bradley Vineyard Pinot Noir (Umpqua Valley),Pinot Noir,Paul O'Brien
539,US,"Bright pomegranate and dried strawberry notes start the aromas on this bottling and then descend into more brooding cola, smoked herbs, cinnamon and spicy hibiscus. There is herbal and mineral depth to the palate, with raspberry, cranberry and pencil lead flavors that evolve toward fruit punch, thyme and earth. It's light in body but full of grippy texture.",Twin Creeks Estate,93,42.0,California,Edna Valley,Central Coast,Matt Kettmann,@mattkettmann,Claiborne & Churchill 2014 Twin Creeks Estate Pinot Noir (Edna Valley),Pinot Noir,Claiborne & Churchill
540,US,"A touch of earthy funk shows at first on the nose of this bottling, laced throughout the dark cranberry, pomegranate, crushed grapeseeds and a lavish layer of violets. The palate is heavily spiced with clove, gingerbread, a touch of juniper, lots of earthy sagebrush and a strong cranberry fruit, all seasoned by an iron-powered minerality.",Bien Nacido Vineyard,93,60.0,California,Santa Maria Valley,Central Coast,Matt Kettmann,@mattkettmann,Flying Goat Cellars 2012 Bien Nacido Vineyard Pinot Noir (Santa Maria Valley),Pinot Noir,Flying Goat Cellars
541,US,"From one of the more exciting and westernmost vineyards in the region, this bottling shows earthy, gamey aromas alongside ripe red and purple fruits, pairing plum and black cherry with minty, musky herbs. The palate shows dried olive, tart orange peels, red plums, baked figs and pine needles, proving deliciously savory and intense.",Solomon Hills Vineyard,93,42.0,California,Santa Maria Valley,Central Coast,Matt Kettmann,@mattkettmann,Flying Goat Cellars 2012 Solomon Hills Vineyard Pinot Noir (Santa Maria Valley),Pinot Noir,Flying Goat Cellars
542,Italy,"Heady scents of pressed jasmine, honey and candied orange waft out of the glass. The concentrated but elegant palate provides layers of mature apricot, lemon drop and ginger brightened by fresh acidity. It's vibrant and well balanced, with a persistent finish.",Praepositus Passito,93,30.0,Northeastern Italy,Alto Adige Valle Isarco,,Kerin O’Keefe,@kerinokeefe,Abbazia di Novacella 2012 Praepositus Passito Kerner (Alto Adige Valle Isarco),Kerner,Abbazia di Novacella
543,US,"Strong elements of black pepper and smoky oak beg for steak to be paired with this 100% varietal wine. It showcases sizable weight and a solid tannic structure, with supple expressions of black cherry and chocolate that linger long on the rich finish. This bold beauty should hold well through 2023.",Cañon Creek Vineyard,93,75.0,California,Napa Valley,Napa,Virginie Boone,@vboone,Midsummer Cellars 2013 Cañon Creek Vineyard Cabernet Sauvignon (Napa Valley),Cabernet Sauvignon,Midsummer Cellars
544,US,"From Paso's blending vanguards, this mix of 62% Syrah, 19% Petite Sirah, 13% Cabernet Sauvignon and 6% Malbec offers an intriguing nose of sesame, soy, cracked pepper, fresh blackberry and raw beef. There is cedar and toasted pine on the palate as well as smoked meats, black pepper, teriyaki and an elderberry-blackberry base.",Reckoning,93,54.0,California,Templeton Gap District,Central Coast,Matt Kettmann,@mattkettmann,ONX 2013 Reckoning Red (Templeton Gap District),Red Blend,ONX
545,US,"This is a gorgeous wine, blended with 8% Merlot, 1% Petit Verdot and 1% Malbec, and aged entirely in new French oak. Juicy waves of cassis and red currant are accented by dark chocolate, ultimately showcasing a lush, plush yet structured palate. It's decadent now, but should age well through 2022.",Les Sommets,93,85.0,California,Napa Valley,Napa,Virginie Boone,@vboone,Les Belles Collines 2012 Les Sommets Cabernet Sauvignon (Napa Valley),Cabernet Sauvignon,Les Belles Collines
546,US,"Crisp green apple is the star in this well-made, balanced and elegant wine, that's tangy yet smooth, with a voluptuous tease of anise. Approachably structured, the complexity of the texture and lurking layers of further flavor suggest letting this wine open slowly to unveil its true self, and allowing it to linger on the palate.",Gap's Crown Vineyard,93,50.0,California,Sonoma Coast,Sonoma,Virginie Boone,@vboone,Lutum 2014 Gap's Crown Vineyard Chardonnay (Sonoma Coast),Chardonnay,Lutum
547,US,"Deep aromas of dried strawberries and blueberries meet with hot bricks, dried meats, purple flowers, a touch of smoke and secondary notes of truffle on the nose of this delicious smelling and tasting wine. The layers of flavor on the palate range from black cherry to milk chocolate, framed by chalky tannins.",Stolpman Vineyard,93,150.0,California,Ballard Canyon,Central Coast,Matt Kettmann,@mattkettmann,Turiya 2011 Stolpman Vineyard Sangiovese (Ballard Canyon),Sangiovese,Turiya
548,US,"This is the producer's highest and most westerly vineyard site. It holds back from the start, still tightly wound and somewhat reduced on the nose. As it opens, ethereal layers of wild strawberry, green tea and lacings of herb and white pepper unveil to tremendous effect.",Thomas Road,93,85.0,California,Green Valley,Sonoma,Virginie Boone,@vboone,Iron Horse 2013 Thomas Road Pinot Noir (Green Valley),Pinot Noir,Iron Horse
549,Italy,"Scents of perfumed dark berry, rose, cake spice and aromatic herb unfold on this structured red. On the full-bodied palate, notes of chopped mint, mocha and white pepper accent a core of mature black cherry. It's young and assertive but well balanced, with firm tannins and bright acidity. Drink 2018–2026.",Resa 56,93,90.0,Piedmont,Barolo,,Kerin O’Keefe,@kerinokeefe,Brandini 2011 Resa 56  (Barolo),Nebbiolo,Brandini
550,US,"The estate-grown grapes for this wine come from some of the appellation's highest-elevation sites, at the base of Mount Veeder. Natural acidity is the star of the show, a nice surprise after a decadent honeyed color and bouquet. Serious texture and complexity give way to a touch of salted caramel and peach.",Estate Reserve,93,35.0,California,Carneros,Napa-Sonoma,Virginie Boone,@vboone,Artesa 2014 Estate Reserve Chardonnay (Carneros),Chardonnay,Artesa
551,US,"From the gorgeous, mighty Pagani, planted in 1895, comes this powerfully rich and refined wine, a study in woodsy rusticity and layers of fig, blackberry and a stick of cinnamon. Full bodied and luxurious on the palate, a lithe jolt of acidity rears its head just before the finish, trying to compete with the licorice and leather. Drink now through 2020.",Pagani Ranch,93,46.0,California,Sonoma Valley,Sonoma,Virginie Boone,@vboone,Carlisle 2013 Pagani Ranch Zinfandel (Sonoma Valley),Zinfandel,Carlisle
552,France,"Coming from a remote estate on the edge of the Lubéron mountains in the north of Provence, this wine is impressively rich. It gains great concentration and structure from the Cabernet Sauvignon and Syrah in the blend. Full of ripe red fruits, it is dense at the end.",,93,20.0,Provence,Coteaux d'Aix-en-Provence,,Roger Voss,@vossroger,Château Vignelaure 2015 Rosé (Coteaux d'Aix-en-Provence),Rosé,Château Vignelaure
553,Argentina,"Smoky, charred aromas of blackberry and blackened spices set up a bold palate with energy to spare. Blackberry and cassis flavors are rich, toasty and chocolaty, while the finish on this full-bodied, ripe Malbec is lengthy and moderately complex. Drink through 2021.",Winemaker's Selection Reserva,93,42.0,Mendoza Province,Mendoza,,Michael Schachner,@wineschach,Clos d'Argentine 2013 Winemaker's Selection Reserva Malbec (Mendoza),Malbec,Clos d'Argentine
554,France,"Named after the Negrel family, owners of the estate, this is the top cuvée in their range. Aging in wood gives it a surprising series of flavors ranging from caramel to spice to buttery toast. While some of the fruit is lost along the way, the wine has a rounded, very complete character that is rich and made for food.",Mas Negrel Cadenet,93,40.0,Provence,Côtes de Provence Sainte-Victoire,,Roger Voss,@vossroger,Mas de Cadenet 2015 Mas Negrel Cadenet Rosé (Côtes de Provence Sainte-Victoire),Rosé,Mas de Cadenet
555,US,"Discovery Vineyard Cab makes up most of this wine, with just a splash of Champoux vineyard Franc to fill it out. Very pretty, very focused aromas of spice box, red and black fruit and herb are followed by a fruit-forward, shamelessly appealing yet still elegant, balanced palate that puts a premium on purity, with a well integrated structure surrounding it all.",,93,75.0,Washington,Horse Heaven Hills,Columbia Valley,Sean P. Sullivan,@wawinereport,Passing Time 2013 Cabernet Sauvignon (Horse Heaven Hills),Cabernet Sauvignon,Passing Time
556,Spain,"Welcoming aromas of wood spice, plum and blackberry become more smoky with airing. This strong-boned RDD is pure and deep, with manageable tannins. Generous flavors of spiced blackberry, tobacco and vanilla finish long, elegant and with a lot in reserve. Drink from 2017 through 2030.",Gran Resalte,93,88.0,Northern Spain,Ribera del Duero,,Michael Schachner,@wineschach,Resalte 2010 Gran Resalte  (Ribera del Duero),Tempranillo,Resalte
557,US,"Winemaker Dennis Martin puts grape grower Stephen Miller's signature on this wine, a nod to the importance of this historic vineyard. The wine shows bright strawberry and raspberry with touch of savory wood smoke as well as hibiscus-laced pastry and a pinch of thyme. Earthy sagebrush and wild herb flavors frame the palate, where cooked cherries and cranberries are spiced by cardamom and dried ginger spice.",Bien Nacido Vineyard,93,40.0,California,Santa Maria Valley,Central Coast,Matt Kettmann,@mattkettmann,Sanctuary 2013 Bien Nacido Vineyard Pinot Noir (Santa Maria Valley),Pinot Noir,Sanctuary
558,US,"It's fun to rattle off a few of the numerous aromas and flavors in this exotic but subtle wine: tangerine, pastry cream, blanched almonds and a touch of honey. The wine is refreshing, dry and nicely braced with acidity, but at the same time rather broad and soothing in texture. In other words, beautifully balanced and wonderfully complex.",Enigma,93,25.0,California,Sierra Foothills,Sierra Foothills,Jim Gordon,@gordone_cellars,Terre Rouge 2014 Enigma White (Sierra Foothills),White Blend,Terre Rouge
559,US,"This mostly Syrah blends in 6% Grenache, combining the two grapes from the property's estate into an opaque, juicy expression of black licorice, tar, cigar, grilled mushrooms atop a meaty steak and plenty of black pepper. Big and bold in every sense of the word, it retains just enough acidity to maintain an inviting nature and beguiling floral backbone.",Hail Mary,93,48.0,California,Russian River Valley,Sonoma,Virginie Boone,@vboone,Limerick Lane 2013 Hail Mary Syrah-Grenache (Russian River Valley),Syrah-Grenache,Limerick Lane
560,US,"As the name makes clear, this wine is made from a head-pruned, older block of very unlikely Syrah at the estate property, as seductive as rare. Plum, black cherry, leather and black pepper jump from the glass, slowly and with purpose, around a core of burly tannin and intensely floral aromatics. This is a great wine.",Headpruned Block,93,45.0,California,Russian River Valley,Sonoma,Virginie Boone,@vboone,Limerick Lane 2013 Headpruned Block Syrah (Russian River Valley),Syrah,Limerick Lane
