,country,description,designation,points,price,province,region_1,region_2,taster_name,taster_twitter_handle,title,variety,winery
680,Spain,"Plum, prune and raspberry aromas are solid. This shows a bright, juicy palate along with traditional Rioja flavors of vanilla, tobacco, savory oak and dried red-berry fruits. Drink through 2018.",Selección Crianza,90,25.0,Northern Spain,Rioja,,Michael Schachner,@wineschach,Bodegas Berceo 2011 Selección Crianza  (Rioja),Tempranillo Blend,Bodegas Berceo
681,US,"All Syrah, this blend of Yakima Valley and Wahluke Slope fruit offers aromas and flavors of cocoa, vanilla, pepper and dark cherry. The pleasing interplay of fruit and barrel comes with a soft, pillowy feel.",ALX,90,42.0,Washington,Columbia Valley (WA),Columbia Valley,Sean P. Sullivan,@wawinereport,Bunnell 2011 ALX Syrah (Columbia Valley (WA)),Syrah,Bunnell
682,Italy,"Made entirely with Pinot Nero, this elegant sparkler offers aromas of rose and red berry. The vibrant, focused palate delivers cherry, strawberry and a hint of cake spices alongside bright acidity and an elegant perlage.",Metodo Classico,90,45.0,Piedmont,Piemonte,,Kerin O’Keefe,@kerinokeefe,Castello di Neive 2011 Metodo Classico Pinot Nero (Piemonte),Pinot Nero,Castello di Neive
683,Italy,"Aromas of underbrush, charred earth and a hint of cedar lead the nose on this blend of Cabernet Sauvignon and 10% Merlot. The extracted palate delivers mature black currant, dried blackberry, espresso and black pepper alongside dusty tannins.",Cignale,90,70.0,Tuscany,Colli della Toscana Centrale,,Kerin O’Keefe,@kerinokeefe,Castello di Querceto 2010 Cignale Red (Colli della Toscana Centrale),Red Blend,Castello di Querceto
684,US,"This wine is aromatically reserved with notes of milk chocolate, char, berry, barrel spices and high-toned herbs. It's silky and polished in feel, with richness and elegance to the coffee flavors.",Canoe Ridge Vineyard,90,30.0,Washington,Horse Heaven Hills,Columbia Valley,Sean P. Sullivan,@wawinereport,Chateau Ste. Michelle 2012 Canoe Ridge Vineyard Cabernet Sauvignon (Horse Heaven Hills),Cabernet Sauvignon,Chateau Ste. Michelle
685,US,"This wine pushes the notion of low alcohol, giving soft and subtle an extreme definition. As such, it will not please everyone. Earthy spice and an exotic notion of orange blossom dance around a light, clear body and high-toned minerality. It hails from a foggy, shaded vineyard in Freestone.",Emmaline Ann Vineyard,90,75.0,California,Sonoma Coast,Sonoma,Virginie Boone,@vboone,Cobb 2012 Emmaline Ann Vineyard Pinot Noir (Sonoma Coast),Pinot Noir,Cobb
686,Italy,"This opens with aromas of underbrush, leather, berry and a balsamic note. The forward palate offers dried cherry, white pepper, tobacco and the warmth of alcohol alongside firm tannins. Drink this sooner rather than later.",Acclivi,90,53.0,Piedmont,Barolo,,Kerin O’Keefe,@kerinokeefe,Comm. G. B. Burlotto 2011 Acclivi  (Barolo),Nebbiolo,Comm. G. B. Burlotto
687,US,"Straw-yellow in the glass, this wine from organically grown, nearly 35-year-old vines shows iodine, citrus pith, yogurt and seared lemon peels in the restrained, minerally nose. The even-keeled, focused palate seamlessly integrates dairy elements with tangerine rinds and a mellow acidity.",Gravel Ridge Vineyard,90,29.0,California,Santa Cruz Mountains,Central Coast,Matt Kettmann,@mattkettmann,Cooper-Garrod 2012 Gravel Ridge Vineyard Chardonnay (Santa Cruz Mountains),Chardonnay,Cooper-Garrod
688,US,"This appealing wine displays aromas of cherry, plum, cocoa, pencil lead and Mounds Bar. It's reserved in style with tart cranberry and cherry flavors, showing a good sense of acid balance along with grainy tannins.",Reserve 34,91,90.0,Washington,Red Mountain,Columbia Valley,Sean P. Sullivan,@wawinereport,Mosquito Fleet 2011 Reserve 34 Cabernet Sauvignon (Red Mountain),Cabernet Sauvignon,Mosquito Fleet
689,US,"From vineyards in the high-desert Cuyama Valley comes this blend of 40% Cabernet Sauvignon, 25% Tempranillo, 20% Grenache and 15% Petite Sirah. On the nose, it shows chopped fresh mint, rose blossoms, fennel, black cherries and teriyaki beef jerky. Black pepper and soy mark the palate, along with blackberry juice and a slate-driven minerality.",Quattro Santa Barbara Highlands Vineyard,91,35.0,California,Santa Barbara County,Central Coast,Matt Kettmann,@mattkettmann,Nadia 2012 Quattro Santa Barbara Highlands Vineyard Red (Santa Barbara County),Red Blend,Nadia
690,Austria,"Still closed, this is redolent of the elegant, nutty notes of new French oak which nonetheless complement the ripe but supple cherry fruit. The tannins are superfine and the addition of peppery Zweigelt to this Cabernet-Merlot blend lends spice and verve to the mix. This was made for the long run, so give it some bottle age and allow it to meld into its elegant self. Drink from 2018.",Nit'ana,91,35.0,Burgenland,,,Anne Krebiehl MW,@AnneInVino,Nittnaus Hans und Christine 2013 Nit'ana Red (Burgenland),Red Blend,Nittnaus Hans und Christine
691,US,"This deep-colored, full-bodied red gets a little swagger in its step from enticing smoky oak aromas and powerful black-fruit flavors that also carry that spicy oak streak. This is brash enough for slow-cooked barbecue but sophisticated enough for osso buco. The texture is fine-grained from supportive tannin, and the finish lingers. Best now through 2018.",Ghielmetti Vineyard Micro-lot Reserve,91,50.0,California,Livermore Valley,Central Coast,Jim Gordon,@gordone_cellars,Nottingham Cellars 2012 Ghielmetti Vineyard Micro-lot Reserve Malbec (Livermore Valley),Malbec,Nottingham Cellars
692,Italy,"Made with Sangiovese blended with 10% Ciliegiolo and 5% Alicante Bouschet, this savory wine opens with aromas of underbrush, ripe berry, tobacco leaf and Mediterranean herb. The vibrant, refined palate doles out juicy black cherry, crushed raspberry, orange peel, licorice and white pepper alongside supple tannins. It closes on a mineral note. Enjoy through 2020.",Capatosta,91,35.0,Tuscany,Morellino di Scansano,,Kerin O’Keefe,@kerinokeefe,Poggio Argentiera 2012 Capatosta  (Morellino di Scansano),Red Blend,Poggio Argentiera
693,US,"Although the fine mountain site straddles both Napa and Sonoma, this wine's fruit is all Sonoma, the bulk of it Cabernet Franc, with 17% Cabernet Sauvignon. Dried cranberry shows on the nose and palate, followed by chalky tannins and a refined use of oak, finishing in a bite of currant and cherry. Enjoy through 2017.",,91,65.0,California,Sonoma County,Sonoma,Virginie Boone,@vboone,Pride Mountain 2012 Cabernet Franc (Sonoma County),Cabernet Franc,Pride Mountain
694,South Africa,"This is a well-balanced, well-structured white wine that's sure to evolve through 2020, at least. It's certainly attractive now, with subtle toasty notes of sweet spice and wood-grilled apple alongside hints of kiwi, sweet grass, green plum and lime. The medium-weight palate offers ample acidity and a streak of minerality that keeps things fresh and lifted through the softly spiced finish.",Reserve,91,50.0,Stellenbosch,,,Lauren Buzzeo,@laurbuzz,Reyneke 2013 Reserve Sauvignon Blanc (Stellenbosch),Sauvignon Blanc,Reyneke
695,Italy,"Aromas of violet, iris, forest floor, woodland berry and allspice lead the nose on this structured, savory wine. The concentrated palate delivers ripe black cherry, mocha, clove, tobacco and licorice alongside velvety tannins and fresh acidity. It's firm and well balanced.",Riserva Ducale Oro Gran Selezione,91,43.0,Tuscany,Chianti Classico,,Kerin O’Keefe,@kerinokeefe,Ruffino 2010 Riserva Ducale Oro Gran Selezione  (Chianti Classico),Red Blend,Ruffino
696,New Zealand,"The Dillons Point subregion of Marlborough often produces particularly pungent examples of Sauvignon Blanc, but this wine doesn't quite hew to that mold. The herbal notes are prominent but well mannered, backed by plenty of mild citrus—think white grapefruit—and melon. Ample weight, a silky texture and a lengthy finish complete the package.",Pioneer Block 20 Dillons Point Cash Block,91,28.0,Marlborough,,,Joe Czerwinski,@JoeCz,Saint Clair 2014 Pioneer Block 20 Dillons Point Cash Block Sauvignon Blanc (Marlborough),Sauvignon Blanc,Saint Clair
697,Austria,"Lively notes of fresh yellow plum and mandarin open up into a friendly, fresh palate that combines rich fruit and zingy citrus to great effect. The result is lip-smacking freshness with lots of midpalate concentration and zing.",von Gösing,91,,Wagram,,,Anne Krebiehl MW,@AnneInVino,Soellner 2014 von Gösing Roter Veltliner (Wagram),Roter Veltliner,Soellner
698,US,"Aromas of dark chocolate, dried and fresh herbs, raspberries and black cherry predominate on this blend of Cabernet Sauvignon, Merlot, Cabernet Franc and Malbec. Creamy, rich and focused, it has a pleasing sense of texture and vanilla flavors that carry across the finish. It's truly a standout wine at this price.",Little Bear Creek,91,20.0,Washington,Columbia Valley (WA),Columbia Valley,Sean P. Sullivan,@wawinereport,Woodinville Wine Cellars 2012 Little Bear Creek Red (Columbia Valley (WA)),Bordeaux-style Red Blend,Woodinville Wine Cellars
699,South Africa,"This classic, iconic Pinotage opens with dense aromas of pressed purple violets, forest berries, raspberry sauce and fudge brownie. The lush and decadent palate offers more of the same, with a crushed velvet texture and final notes of licorice and toasted spice that linger long. It's delicious now, but should hold well through 2022.",Estate Wine,91,40.0,Simonsberg-Stellenbosch,,,Lauren Buzzeo,@laurbuzz,Kanonkop 2012 Estate Wine Pinotage (Simonsberg-Stellenbosch),Pinotage,Kanonkop
700,Argentina,"Intriguing aromas of lavender, hoja santa and green tobacco blend nicely with blackberry and blueberry scents. This top-flight Bonarda feels lush and only moderately tannic. Blackberry, leather and mild briny flavors finish minty and lightly herbal. Drink now.",,91,30.0,Mendoza Province,Mendoza,,Michael Schachner,@wineschach,El Enemigo 2012 Bonarda (Mendoza),Bonarda,El Enemigo
701,France,"Always released after a further year's aging, this rich and full-bodied wine is now at its peak. With a dense texture, layers of spice and vanilla as well as intense red fruits, this powerful wine expresses the more complex side of Provence rosé. Drink now.",Les Clans,91,65.0,Provence,Côtes de Provence,,Roger Voss,@vossroger,Château d'Esclans 2013 Les Clans Rosé (Côtes de Provence),Rosé,Château d'Esclans
702,France,"Produced by the owners of Châteauneuf-du-Pape estate Château Mont-Redon, this is a full and fruity wine. It has a good balance between acidity and red berry fruits that give a rich character. Packed with flavor, it's ready to drink.",,91,17.0,Provence,Côtes de Provence,,Roger Voss,@vossroger,Château Riotor 2014 Rosé (Côtes de Provence),Rosé,Château Riotor
703,France,"While the wine is really pale in color, it does have a great range of flavors, offering red fruit notes balanced by beautiful acidity and citrus streaks. It's gently textured, giving a good bite to the fruitiness at the end.",,91,,Provence,Côtes de Provence,,Roger Voss,@vossroger,Château Sainte Marguerite 2014 Rosé (Côtes de Provence),Rosé,Château Sainte Marguerite
704,France,"This rich and impressive wine has structure and a firm texture, partly from the Cabernet Sauvignon in the blend (45% Grenache, 35% Syrah, 20% Cabernet Sauvignon). It is dense and full of juicy red fruits, caramel and delicious spice. Production is only 2,500 cases. It would be worth aging for a few more months, so drink from late 2015.",,91,20.0,Provence,Coteaux d'Aix-en-Provence,,Roger Voss,@vossroger,Château Vignelaure 2014 Rosé (Coteaux d'Aix-en-Provence),Rosé,Château Vignelaure
705,New Zealand,"Classic gooseberry and pink grapefruit notes feature gentle herbal nuances on the nose. There's ample weight and texture on the palate, with a burst of mouthwatering citrus on the finish.",,91,28.0,Marlborough,,,Joe Czerwinski,@JoeCz,Cloudy Bay 2014 Sauvignon Blanc (Marlborough),Sauvignon Blanc,Cloudy Bay
706,France,"Very fruity and fresh, this wine has crisp apples as well as red fruit giving it a bright, delicious feeling. The acidity goes right through the wine, giving a beautifully fresh feel that points up the fragrant raspberries. Vineyards are in the heart of the sandy soils of the Saint Tropez peninsula.",TwoB,91,20.0,Provence,Côtes de Provence,,Roger Voss,@vossroger,Domaine de la Bastide Blanche 2014 TwoB Rosé (Côtes de Provence),Rosé,Domaine de la Bastide Blanche
707,France,"Rounded and soft, this rich rosé is fruity while also perfumed. The blending of Syrah in the mix gives the wine a sense of power and concentration, making it an adquate partner at the dinner table.",L'Esprit de Provence,91,20.0,Provence,Côtes de Provence,,Roger Voss,@vossroger,Domaine du Grand Cros 2014 L'Esprit de Provence Rosé (Côtes de Provence),Rosé,Domaine du Grand Cros
708,France,"This wine is full in the mouth with a taste between pepper and fruit. It's ripe, rounded and tangy with clementine zest as well crisp apples and red currants. It could benefit from a few months in bottle, so drink from late 2015.",VieVité Extraordinaire,91,25.0,Provence,Côtes de Provence,,Roger Voss,@vossroger,Domaine Sainte-Marie 2014 VieVité Extraordinaire Rosé (Côtes de Provence),Rosé,Domaine Sainte-Marie
709,US,"Only the second vintage of this vineyard-designate wine from an estate property, this bottling offers spicy cherry, black tea and dried herb, backed by oaky backbone and structure. Dark chocolate and leather play on the palate in subtle waves, hitting their strides on the finish. Cellar through 2020.",DCV2 Estate Four Clones Vineyard,91,38.0,California,Dry Creek Valley,Sonoma,Virginie Boone,@vboone,Dry Creek Vineyard 2012 DCV2 Estate Four Clones Vineyard Zinfandel (Dry Creek Valley),Zinfandel,Dry Creek Vineyard
710,New Zealand,"As typical for Dry River Pinots, this one is pretty surly in its youth. Intense and astringent, it packs layers of dusty black-cherry fruit into a tightly coiled frame. Try after 2019.",,91,120.0,Martinborough,,,Joe Czerwinski,@JoeCz,Dry River 2013 Pinot Noir (Martinborough),Pinot Noir,Dry River
711,US,"Floral and herbal from the get-go, this medium-bodied white from a great vineyard offers a lot to like. Stainless-steel fermentation gives it a lean underbelly, rounded out by sharp Meyer lemon and tangerine, buoyed by mouthwatering acidity. Green apple and an accent of honey peak on the finish.",Cohen Vineyard Dutton Ranch,91,23.0,California,Russian River Valley,Sonoma,Virginie Boone,@vboone,Dutton Estate 2013 Cohen Vineyard Dutton Ranch Sauvignon Blanc (Russian River Valley),Sauvignon Blanc,Dutton Estate
712,US,"Light in color and weight, this vineyard-designate conveys a wealth of rose petals, earth and bright, crisp red cherry. Compellingly layered and shy, it defines the term ethereal. The finish is medium in length and accented in spicy cardamom.",Keefer Ranch,91,48.0,California,Russian River Valley,Sonoma,Virginie Boone,@vboone,Failla 2013 Keefer Ranch Pinot Noir (Russian River Valley),Pinot Noir,Failla
713,US,"This wine combines fruit from both cool and warm sites, which in the vintage might have both leaned on the warmer side. Black fruit and licorice give it a burly character at first. Decanting or letting the wine open in the glass will help, but still it retains smooth, velvety tannins and resolved oak.",Dichotomy,91,32.0,California,Russian River Valley,Sonoma,Virginie Boone,@vboone,Friedeman 2013 Dichotomy Pinot Noir (Russian River Valley),Pinot Noir,Friedeman
714,New Zealand,"Alluring notes of Asian five spice and wet stone frame ripe cherry aromas in this medium-bodied wine. The texture is firm, becoming faintly dusty on the finish, but the wine is approachable now for its cherry fruit and appealing damp clay quality. Drink now–2018.",Bannockburn,91,50.0,Central Otago,,,Joe Czerwinski,@JoeCz,Akarua 2012 Bannockburn Pinot Noir (Central Otago),Pinot Noir,Akarua
715,Argentina,"Sweet oak and vanilla aromas are front and center on a jammy bouquet that also features black plum and blackberry scents. This blend of Malbec, Petit Verdot and Tannat feels full, lifted and balanced. Ripe, enticing flavors of wild berry and cassis are backed by toast, chocolate, vanilla and coconut notes as well as heat and burn. Drink through 2019.",Trisagio Malbec-Petit Verdot-Tannat,91,28.0,Mendoza Province,Valle de Uco,,Michael Schachner,@wineschach,Benvenuto de la Serna 2010 Trisagio Malbec-Petit Verdot-Tannat Red (Valle de Uco),Red Blend,Benvenuto de la Serna
716,New Zealand,"Even Carrick's entry-level wine has turned out well in 2013, offering a sturdy, robust mouthful of dark fruit. Plum, espresso and dark chocolate mingle on the nose and palate, while the finish is long, faintly dusty and mouthwatering. Drink 2017–2025.",Unravelled,91,30.0,Central Otago,,,Joe Czerwinski,@JoeCz,Carrick 2013 Unravelled Pinot Noir (Central Otago),Pinot Noir,Carrick
717,France,"An addition to the worldwide JCB brand, produced by the Boisset family of Burgundy, this feels rich and sumptuous, full of ripe red fruits and juicy plums. It is also balanced and well structured. Drink this wine with food.",No. 5,91,25.0,Provence,Côtes de Provence,,Roger Voss,@vossroger,JCB 2014 No. 5 Rosé (Côtes de Provence),Rosé,JCB
718,Portugal,"Heading nicely in the crisp and aromatic direction, this is a light and bright wine. It has a citrus flavor that is balanced by richer pear and plum fruits. The wine is ready to drink.",Bote Chardonnay-Fernão Pires-Vital,85,8.0,Lisboa,,,Roger Voss,@vossroger,Casca Wines 2015 Bote Chardonnay-Fernão Pires-Vital White (Lisboa),Portuguese White,Casca Wines
719,France,"This soft wine has a gentle texture and smooth white fruits. It is fruity and lightly perfumed. With its crisp edge of acidity, is totally ready to drink.",Grande Réserve du Président,85,15.0,Burgundy,Mâcon-Villages,,Roger Voss,@vossroger,Cave de Viré 2015 Grande Réserve du Président  (Mâcon-Villages),Chardonnay,Cave de Viré
720,Portugal,"Onion skin orange in color, this is a full and fat wine. It has attractive red-berry fruit and just the right amount of acidity to keep it fresh and crisp. Drink now.",,85,22.0,Alentejano,,,Roger Voss,@vossroger,Cortes de Cima 2015 Rosé (Alentejano),Rosé,Cortes de Cima
721,Argentina,"Saucy berry and tea aromas are herbal, earthy and stewed. This feels full but syrupy. Flavors of cooked berry, molasses and mocha finish sweet and soupy, with only a touch of acidic offset.",,85,14.0,Mendoza Province,Tupungato,,Michael Schachner,@wineschach,Domaine Bousquet 2015 Cabernet Sauvignon (Tupungato),Cabernet Sauvignon,Domaine Bousquet
722,Argentina,"Mushy citrus and papaya aromas are waxy and lack pop. Angular and lemony in feel, this varietal white offers a one-note flavor profile based on lemon. A ringing, citric finish affords for a hint of tropical fruit.",,85,25.0,Mendoza Province,Mendoza,,Michael Schachner,@wineschach,Mendel 2015 Semillon (Mendoza),Sémillon,Mendel
723,Portugal,"In a medium sweet style, the wine has a light prickle and fine citrus acidity to balance the soft freshness. It is a refreshing wine, totally drinkable immediately.",Santola,85,8.0,Vinho Verde,,,Roger Voss,@vossroger,Messias 2015 Santola White (Vinho Verde),Portuguese White,Messias
724,US,"Peach, banana peel and a slight petrol note show mildly on the nose. The round palate boasts tart peach, pineapple rind and bitter lemon zest.",Mont Sec Vineyards,85,14.0,Texas,Texas,,Alexander Peartree,,Mont Sec 2015 Mont Sec Vineyards Viognier (Texas),Viognier,Mont Sec
725,Italy,"This has aromas that recall leafy underbrush, sawdust and menthol. The dense, oak-driven palate shows licorice, espresso, toast and a hint of bitter chocolate but the fruit has dried up. It abruptly ends on a green note of powdered sage.",Meriame,85,80.0,Piedmont,Barolo,,Kerin O’Keefe,@kerinokeefe,Paolo Manzone 2012 Meriame  (Barolo),Nebbiolo,Paolo Manzone
726,Portugal,"A rose pink colored wine that is dry and with ripe fruit. Its acidity contrasts with the warm red-berry fruit and the edge of tannin. There is a peppery, crisp aftertaste.",Casa de Paços,85,9.0,Vinho Verde,,,Roger Voss,@vossroger,Quinta de Paços 2015 Casa de Paços Rosé (Vinho Verde),Rosé,Quinta de Paços
727,US,"Light strawberry fruit carries an undertone of dried grass. It turns a little sour in the mouth, but it's fine for the price.",,85,13.0,Oregon,Oregon,Oregon Other,Paul Gregutt,@paulgwine ,Rascal 2014 Pinot Noir (Oregon),Pinot Noir,Rascal
728,Argentina,"Initial aromas of lychee and jasmine are varietally correct but this struggles to stay fresh and instead turns oily on the nose. A mid-level palate holds nectarine, lychee and oily flavors that turn bitter on the finish.",Reserva,85,17.0,Other,Salta,,Michael Schachner,@wineschach,Terrazas de Los Andes 2015 Reserva Torrontés (Salta),Torrontés,Terrazas de Los Andes
729,Portugal,"The wine is ripe with apple and creamed pear flavors. It is warm, rich and missing acidity. There is an attractive almond and spice character to this ripe wine. Drink now.",Audaz Branco,85,10.0,Alentejano,,,Roger Voss,@vossroger,Herdade Grande 2015 Audaz Branco White (Alentejano),Portuguese White,Herdade Grande
730,US,"This wine looks, smells and tastes on the light side. Herb and red-cherry aromas precede rather lean flavors from cherry to clove and dill, and a brisk texture with some tannic grip.",,85,16.0,California,California,California Other,Jim Gordon,@gordone_cellars,Jack's House 2013 Cabernet Sauvignon (California),Cabernet Sauvignon,Jack's House
731,France,"Here is a simple but tasty Chard, offering attractive notes of pear, spiced orange and toasted apple skin on the nose and mouth. It's light weight and well balanced, with ample acidity and a short but clean finish. Enjoy now.",Bin 068,85,10.0,France Other,Vin de France,,Lauren Buzzeo,@laurbuzz,Kiwi Cuvée 2014 Bin 068 Chardonnay (Vin de France),Chardonnay,Kiwi Cuvée
732,France,"This is a soft and jammy wine with attractive ripe strawberry fruit and only the lightest structure. It is gentle, rounded and ready to drink.",Mont-Avril,85,22.0,Burgundy,Côte Chalonnaise,,Roger Voss,@vossroger,Domaine Michel Goubard 2014 Mont-Avril  (Côte Chalonnaise),Pinot Noir,Domaine Michel Goubard
733,France,"This wine is extracted and tough. The acidity does come through to help out, although it still has a hard edge with some bitter toast. It will soften, leaving some perfumed fruit for the future.",,85,40.0,Burgundy,Chorey-lès-Beaune,,Roger Voss,@vossroger,Domaine Poulleau Père et Fils 2014  Chorey-lès-Beaune,Pinot Noir,Domaine Poulleau Père et Fils
734,Argentina,"Raisiny and earthy on the nose, this Bonarda also offers damp aromas of fern and tobacco. Chunky, with a soft, flat palate, this tastes raisiny and stewed. Low acidity and raisiny flavors on the finish are consistent with what came before.",,85,15.0,Mendoza Province,Mendoza,,Michael Schachner,@wineschach,Durigutti 2014 Bonarda (Mendoza),Bonarda,Durigutti
735,Argentina,"Oily, gritty aromas of almond skins set up a pungent but oily tasting palate. Core fruit flavors lean towards sour grapefruit and orange, while the finish is tangy, salty and sour through the last note.",Don David Reserve,85,17.0,Other,Calchaquí Valley,,Michael Schachner,@wineschach,El Esteco 2015 Don David Reserve Torrontés (Calchaquí Valley),Torrontés,El Esteco
736,US,"A rare miss for this winery, this bottling shows cooked red cherries, dust, vanilla and caramel on the somewhat hollow nose. The palate is almost overly rich with caramelized black cherry, fudge and chalky tannins. Patience will likely improve this one.",,85,32.0,California,Paso Robles,Central Coast,Matt Kettmann,@mattkettmann,Felten Cellars 2013 Tempranillo (Paso Robles),Tempranillo,Felten Cellars
737,Portugal,"This raspberry-flavored wine is soft and ripe. While it is fruity, it also has a nutty character that gives it a rich taste. It's dry and in a style that will make it better with food than by itself.",Casa Ermelinda Freitas Monte de Baía,85,12.0,Península de Setúbal,,,Roger Voss,@vossroger,Wines & Winemakers 2015 Casa Ermelinda Freitas Monte de Baía Rosé (Península de Setúbal),Rosé,Wines & Winemakers
738,Argentina,"Roasted, stewed berry aromas are rustic and suggestive of grilled meat. This is high in acidity, and thus it feels sharp and edgy. Flavors of forced oak, related spice and tart plum end with a scraping, tannic feel and herbal berry flavors.",Henry Legarde,85,17.0,Mendoza Province,Luján de Cuyo,,Michael Schachner,@wineschach,Lagarde 2013 Henry Legarde Malbec (Luján de Cuyo),Malbec,Lagarde
739,Italy,"Roasted coffee bean and menthol aromas lead the nose while the evolved palate offers dark bitter chocolate, licorice and a toasted note. Showing the heat of the vintage, the fruit has largely dried up while astringent tannins lead to a bracing finish.",Riserva,85,102.0,Piedmont,Barolo,,Kerin O’Keefe,@kerinokeefe,Marchesi di Barolo 2009 Riserva  (Barolo),Nebbiolo,Marchesi di Barolo
740,US,"There seems to be a dusty veil over the fruit of this sold, approachable Sangiovese. A bit of sweet spice creeps up on the palate, making it enjoyable by itself or paired alongside pizza Tuesday.",,85,,Texas,Texas,,Alexander Peartree,,McPherson 2014 Sangiovese (Texas),Sangiovese,McPherson
741,France,This light and fruity wine offers soft tannins and an earthy character. The wine comes mainly from Beaujolais with 15% of Pinot Noir from the Mâcon region. Drink now.,,85,10.0,Burgundy,Coteaux Bourguignons,,Roger Voss,@vossroger,Patriarche Père et Fils 2014  Coteaux Bourguignons,Pinot Noir-Gamay,Patriarche Père et Fils
